{
  "eventClass": "S-2399",
  "tenantId": "tenant-a",
  "sourceEventId": "source-event-S-2399",
  "sourceEntityId": "source-entity-S-2399",
  "environment": "qualification",
  "employerCnpj": "12345678000199",
  "kind": "intern",
  "contractId": "tsv-contract-1",
  "cpf": "12345678901",
  "registration": "TSV-1",
  "terminationDate": "2026-05-31",
  "acceptedS2300Receipt": "1.1.0000000000000002300",
  "acceptedS2306Receipt": "1.1.0000000000000002306"
}
